"podc","conf/podc/2001",2001,"ACM","Proceedings of the Twentieth Annual ACM Symposium on Principles of Distributed Computing, PODC 2001, Newport, Rhode Island, USA, August 26-29, 2001","http://dl.acm.org/citation.cfm?id=383962",0,0,0,1
"podc","conf/podc/2002",2002,"ACM","Proceedings of the Twenty-First Annual ACM Symposium on Principles of Distributed Computing, PODC 2002, Monterey, California, USA, July 21-24, 2002","http://dl.acm.org/citation.cfm?id=571825",0,0,0,1
"podc","conf/podc/2003",2003,"ACM","Proceedings of the Twenty-Second ACM Symposium on Principles of Distributed Computing, PODC 2003, Boston, Massachusetts, USA, July 13-16, 2003","http://dl.acm.org/citation.cfm?id=872035",0,0,0,1
"podc","conf/podc/2004",2004,"ACM","Proceedings of the Twenty-Third Annual ACM Symposium on Principles of Distributed Computing, PODC 2004, St. John's, Newfoundland, Canada, July 25-28, 2004","http://dl.acm.org/citation.cfm?id=1011767",0,0,0,1
"podc","conf/podc/2005",2005,"ACM","Proceedings of the Twenty-Fourth Annual ACM Symposium on Principles of Distributed Computing, PODC 2005, Las Vegas, NV, USA, July 17-20, 2005","http://dl.acm.org/citation.cfm?id=1073814",0,0,0,1
"podc","conf/podc/2006",2006,"ACM","Proceedings of the Twenty-Fifth Annual ACM Symposium on Principles of Distributed Computing, PODC 2006, Denver, CO, USA, July 23-26, 2006","http://dl.acm.org/citation.cfm?id=1146381",0,0,0,1
"podc","conf/podc/2007",2007,"ACM","Proceedings of the Twenty-Sixth Annual ACM Symposium on Principles of Distributed Computing, PODC 2007, Portland, Oregon, USA, August 12-15, 2007","http://dl.acm.org/citation.cfm?id=1281100",0,0,0,1
"podc","conf/podc/2008",2008,"ACM","Proceedings of the Twenty-Seventh Annual ACM Symposium on Principles of Distributed Computing, PODC 2008, Toronto, Canada, August 18-21, 2008","http://dl.acm.org/citation.cfm?id=1400751",0,0,0,1
"podc","conf/podc/2009",2009,"ACM","Proceedings of the 28th Annual ACM Symposium on Principles of Distributed Computing, PODC 2009, Calgary, Alberta, Canada, August 10-12, 2009","http://dl.acm.org/citation.cfm?id=1582716",0,0,0,1
"podc","conf/podc/2010",2010,"ACM","Proceedings of the 29th Annual ACM Symposium on Principles of Distributed Computing, PODC 2010, Zurich, Switzerland, July 25-28, 2010","http://dl.acm.org/citation.cfm?id=1835698",0,0,0,1
"podc","conf/podc/2010wras",2010,"ACM","Proceedings of the Third International Workshop on Reliability, Availability, and Security, WRAS 2010, conjunction with PODC 2010 Zurich, Switzerland, July 29, 2010","http://dl.acm.org/citation.cfm?id=1953563",0,0,0,1
"podc","conf/podc/2011",2011,"ACM","Proceedings of the 30th Annual ACM Symposium on Principles of Distributed Computing, PODC 2011, San Jose, CA, USA, June 6-8, 2011","http://dl.acm.org/citation.cfm?id=1993806",0,0,0,1
"podc","conf/podc/2012",2012,"ACM","ACM Symposium on Principles of Distributed Computing, PODC '12, Funchal, Madeira, Portugal, July 16-18, 2012","http://dl.acm.org/citation.cfm?id=2332432",0,0,0,1
"podc","conf/podc/2013",2013,"ACM","ACM Symposium on Principles of Distributed Computing, PODC '13, Montreal, QC, Canada, July 22-24, 2013","http://dl.acm.org/citation.cfm?id=2484239",0,0,0,1
"podc","conf/podc/2014",2014,"ACM","ACM Symposium on Principles of Distributed Computing, PODC '14, Paris, France, July 15-18, 2014","http://dl.acm.org/citation.cfm?id=2611462",0,0,0,1
"podc","conf/podc/2014armscc",2014,"Springer","Adaptive Resource Management and Scheduling for Cloud Computing - First International Workshop, ARMS-CC 2014, held in Conjunction with ACM Symposium on Principles of Distributed Computing, PODC 2014, Paris, France, July 15, 2014, Revised Selected Papers","http://dx.doi.org/10.1007/978-3-319-13464-2",0,0,0,1
"podc","conf/podc/2015",2015,"ACM","Proceedings of the 2015 ACM Symposium on Principles of Distributed Computing, PODC 2015, Donostia-San Sebastián, Spain, July 21 - 23, 2015","http://dl.acm.org/citation.cfm?id=2767386",0,0,0,1
"podc","conf/podc/2015armscc",2015,"Springer","Adaptive Resource Management and Scheduling for Cloud Computing - Second International Workshop, ARMS-CC 2015, Held in Conjunction with ACM Symposium on Principles of Distributed Computing, PODC 2015, Donostia-San Sebastián, Spain, July 20, 2015, Revised Selected Papers","http://dx.doi.org/10.1007/978-3-319-28448-4",0,0,0,1
"podc","conf/podc/2016",2016,"ACM","Proceedings of the 2016 ACM Symposium on Principles of Distributed Computing, PODC 2016, Chicago, IL, USA, July 25-28, 2016","http://doi.acm.org/10.1145/2933057",0,0,0,1
"pods","conf/pods/00",2000,"ACM","Proceedings of the Nineteenth ACM SIGMOD-SIGACT-SIGART Symposium on Principles of Database Systems, May 15-17, 2000, Dallas, Texas, USA","http://dl.acm.org/citation.cfm?id=335168",1,1,0,0
"pods","conf/pods/2001",2001,"ACM","Proceedings of the Twentieth ACM SIGACT-SIGMOD-SIGART Symposium on Principles of Database Systems, May 21-23, 2001, Santa Barbara, California, USA","http://dl.acm.org/citation.cfm?id=375551",1,1,0,0
"pods","conf/pods/2002",2002,"ACM","Proceedings of the Twenty-first ACM SIGACT-SIGMOD-SIGART Symposium on Principles of Database Systems, June 3-5, Madison, Wisconsin, USA","http://dl.acm.org/citation.cfm?id=543613",1,1,0,0
"pods","conf/pods/2003",2003,"ACM","Proceedings of the Twenty-Second ACM SIGACT-SIGMOD-SIGART Symposium on Principles of Database Systems, June 9-12, 2003, San Diego, CA, USA","http://dl.acm.org/citation.cfm?id=773153",1,1,0,0
"pods","conf/pods/2004",2004,"ACM","Proceedings of the Twenty-third ACM SIGACT-SIGMOD-SIGART Symposium on Principles of Database Systems, June 14-16, 2004, Paris, France","http://dl.acm.org/citation.cfm?id=1055558",1,1,0,0
"pods","conf/pods/2005",2005,"ACM","Proceedings of the Twenty-fourth ACM SIGACT-SIGMOD-SIGART Symposium on Principles of Database Systems, June 13-15, 2005, Baltimore, Maryland, USA","http://dl.acm.org/citation.cfm?id=1065167",1,1,0,0
"pods","conf/pods/2006",2006,"ACM","Proceedings of the Twenty-Fifth ACM SIGACT-SIGMOD-SIGART Symposium on Principles of Database Systems, June 26-28, 2006, Chicago, Illinois, USA","http://dl.acm.org/citation.cfm?id=1142351",1,1,0,0
"pods","conf/pods/2007",2007,"ACM","Proceedings of the Twenty-Sixth ACM SIGACT-SIGMOD-SIGART Symposium on Principles of Database Systems, June 11-13, 2007, Beijing, China","http://dl.acm.org/citation.cfm?id=1265530",1,1,0,0
"pods","conf/pods/2008",2008,"ACM","Proceedings of the Twenty-Seventh ACM SIGMOD-SIGACT-SIGART Symposium on Principles of Database Systems, PODS 2008, June 9-11, 2008, Vancouver, BC, Canada","http://dl.acm.org/citation.cfm?id=1376916",1,1,0,0
"pods","conf/pods/2009",2009,"ACM","Proceedings of the Twenty-Eigth ACM SIGMOD-SIGACT-SIGART Symposium on Principles of Database Systems, PODS 2009, June 19 - July 1, 2009, Providence, Rhode Island, USA","http://dl.acm.org/citation.cfm?id=1559795",1,1,0,0
"pods","conf/pods/2010",2010,"ACM","Proceedings of the Twenty-Ninth ACM SIGMOD-SIGACT-SIGART Symposium on Principles of Database Systems, PODS 2010, June 6-11, 2010, Indianapolis, Indiana, USA","http://dl.acm.org/citation.cfm?id=1807085",1,1,0,0
"pods","conf/pods/2011",2011,"ACM","Proceedings of the 30th ACM SIGMOD-SIGACT-SIGART Symposium on Principles of Database Systems, PODS 2011, June 12-16, 2011, Athens, Greece","http://dl.acm.org/citation.cfm?id=1989284",1,1,0,0
"pods","conf/pods/2012",2012,"ACM","Proceedings of the 31st ACM SIGMOD-SIGACT-SIGART Symposium on Principles of Database Systems, PODS 2012, Scottsdale, AZ, USA, May 20-24, 2012","http://dl.acm.org/citation.cfm?id=2213556",1,1,0,0
"pods","conf/pods/2013",2013,"ACM","Proceedings of the 32nd ACM SIGMOD-SIGACT-SIGART Symposium on Principles of Database Systems, PODS 2013, New York, NY, USA - June 22 - 27, 2013","http://dl.acm.org/citation.cfm?id=2463664",1,1,0,0
"pods","conf/pods/2014",2014,"ACM","Proceedings of the 33rd ACM SIGMOD-SIGACT-SIGART Symposium on Principles of Database Systems, PODS'14, Snowbird, UT, USA, June 22-27, 2014","http://dl.acm.org/citation.cfm?id=2594538",1,1,0,0
"pods","conf/pods/2015",2015,"ACM","Proceedings of the 34th ACM Symposium on Principles of Database Systems, PODS 2015, Melbourne, Victoria, Australia, May 31 - June 4, 2015","http://dl.acm.org/citation.cfm?id=2745754",1,1,0,0
"pods","conf/pods/2016",2016,"ACM","Proceedings of the 35th ACM SIGMOD-SIGACT-SIGAI Symposium on Principles of Database Systems, PODS 2016, San Francisco, CA, USA, June 26 - July 01, 2016","http://doi.acm.org/10.1145/2902251",1,1,0,0
"popl","conf/popl/2000",2000,"ACM","POPL 2000, Proceedings of the 27th ACM SIGPLAN-SIGACT Symposium on Principles of Programming Languages, Boston, Massachusetts, USA, January 19-21, 2000","http://dl.acm.org/citation.cfm?id=325694",0,1,0,0
"popl","conf/popl/2001",2001,"ACM","Conference Record of POPL 2001: The 28th ACM SIGPLAN-SIGACT Symposium on Principles of Programming Languages, London, UK, January 17-19, 2001","http://dl.acm.org/citation.cfm?id=360204",0,1,0,0
"popl","conf/popl/2002",2002,"ACM","Conference Record of POPL 2002: The 29th SIGPLAN-SIGACT Symposium on Principles of Programming Languages, Portland, OR, USA, January 16-18, 2002","http://dl.acm.org/citation.cfm?id=503272",0,1,0,0
"popl","conf/popl/2003",2003,"ACM","Conference Record of POPL 2003: The 30th SIGPLAN-SIGACT Symposium on Principles of Programming Languages, New Orleans, Louisisana, USA, January 15-17, 2003","http://dl.acm.org/citation.cfm?id=604131",0,1,0,0
"popl","conf/popl/2004",2004,"ACM","Proceedings of the 31st ACM SIGPLAN-SIGACT Symposium on Principles of Programming Languages, POPL 2004, Venice, Italy, January 14-16, 2004","http://dl.acm.org/citation.cfm?id=964001",0,1,0,0
"popl","conf/popl/2005",2005,"ACM","Proceedings of the 32nd ACM SIGPLAN-SIGACT Symposium on Principles of Programming Languages, POPL 2005, Long Beach, California, USA, January 12-14, 2005","http://dl.acm.org/citation.cfm?id=1040305",0,1,0,0
"popl","conf/popl/2005wits",2005,"ACM","Proceedings of the POPL 2005 Workshop on Issues in the Theory of Security, WITS 2005, Long Beach, California, USA, January 10-11, 2005",\N,0,1,0,0
"popl","conf/popl/2006",2006,"ACM","Proceedings of the 33rd ACM SIGPLAN-SIGACT Symposium on Principles of Programming Languages, POPL 2006, Charleston, South Carolina, USA, January 11-13, 2006","http://dl.acm.org/citation.cfm?id=1111037",0,1,0,0
"popl","conf/popl/2007",2007,"ACM","Proceedings of the 34th ACM SIGPLAN-SIGACT Symposium on Principles of Programming Languages, POPL 2007, Nice, France, January 17-19, 2007","http://dl.acm.org/citation.cfm?id=1190216",0,1,0,0
"popl","conf/popl/2007damp",2007,"ACM","Proceedings of the POPL 2007 Workshop on Declarative Aspects of Multicore Programming, DAMP 2007, Nice, France, January 16, 2007",\N,0,1,0,0
"popl","conf/popl/2008",2008,"ACM","Proceedings of the 35th ACM SIGPLAN-SIGACT Symposium on Principles of Programming Languages, POPL 2008, San Francisco, California, USA, January 7-12, 2008","http://dl.acm.org/citation.cfm?id=1328438",0,1,0,0
"popl","conf/popl/2009",2009,"ACM","Proceedings of the 36th ACM SIGPLAN-SIGACT Symposium on Principles of Programming Languages, POPL 2009, Savannah, GA, USA, January 21-23, 2009","http://dl.acm.org/citation.cfm?id=1480881",0,1,0,0
"popl","conf/popl/2009damp",2009,"ACM","Proceedings of the POPL 2009 Workshop on Declarative Aspects of Multicore Programming, DAMP 2009, Savannah, GA, USA, January 20, 2009",\N,0,1,0,0
"popl","conf/popl/2010",2010,"ACM","Proceedings of the 37th ACM SIGPLAN-SIGACT Symposium on Principles of Programming Languages, POPL 2010, Madrid, Spain, January 17-23, 2010","http://dl.acm.org/citation.cfm?id=1706299",0,1,0,0
"popl","conf/popl/2010damp",2010,"ACM","Proceedings of the POPL 2010 Workshop on Declarative Aspects of Multicore Programming, DAMP 2010, Madrid, Spain, January 19, 2010",\N,0,1,0,0
"popl","conf/popl/2011",2011,"ACM","Proceedings of the 38th ACM SIGPLAN-SIGACT Symposium on Principles of Programming Languages, POPL 2011, Austin, TX, USA, January 26-28, 2011","http://dl.acm.org/citation.cfm?id=1926385",0,1,0,0
"popl","conf/popl/2011damp",2011,"ACM","Proceedings of the POPL 2011 Workshop on Declarative Aspects of Multicore Programming, DAMP 2011, Austin, TX, USA, January 23, 2011",\N,0,1,0,0
"popl","conf/popl/2012",2012,"ACM","Proceedings of the 39th ACM SIGPLAN-SIGACT Symposium on Principles of Programming Languages, POPL 2012, Philadelphia, Pennsylvania, USA, January 22-28, 2012","http://dl.acm.org/citation.cfm?id=2103656",0,1,0,0
"popl","conf/popl/2012damp",2012,"ACM","Proceedings of the POPL 2012 Workshop on Declarative Aspects of Multicore Programming, DAMP 2012, Philadelphia, PA, USA, Saturday, January 28, 2012","http://dl.acm.org/citation.cfm?id=2103736",0,1,0,0
"popl","conf/popl/2013",2013,"ACM","The 40th Annual ACM SIGPLAN-SIGACT Symposium on Principles of Programming Languages, POPL '13, Rome, Italy - January 23 - 25, 2013","http://dl.acm.org/citation.cfm?id=2429069",0,1,0,0
"popl","conf/popl/2013ddfp",2013,"ACM","Proceedings of the 2013 Workshop on Data Driven Functional Programming, DDFP 2013, Rome, Italy, January 22, 2013","http://dl.acm.org/citation.cfm?id=2429376",0,1,0,0
"popl","conf/popl/2013pprew",2013,"ACM","Proceedings of the 2nd ACM SIGPLAN Program Protection and Reverse Engineering Workshop 2013, PPREW@POPL 2013, January 26, 2013, Rome, Italy","http://dl.acm.org/citation.cfm?id=2430553",0,1,0,0
"popl","conf/popl/2014",2014,"ACM","The 41st Annual ACM SIGPLAN-SIGACT Symposium on Principles of Programming Languages, POPL '14, San Diego, CA, USA, January 20-21, 2014","http://dl.acm.org/citation.cfm?id=2535838",0,1,0,0
"popl","conf/popl/2014pprew",2014,"ACM","Proceedings of the 3rd ACM SIGPLAN Program Protection and Reverse Engineering Workshop 2014, PPREW 2014, January 25, 2014, San Diego, CA","http://dl.acm.org/citation.cfm?id=2556464",0,1,0,0
"popl","conf/popl/2015",2015,"ACM","Proceedings of the 42nd Annual ACM SIGPLAN-SIGACT Symposium on Principles of Programming Languages, POPL 2015, Mumbai, India, January 15-17, 2015","http://dl.acm.org/citation.cfm?id=2676726",0,1,0,0
"popl","conf/popl/2015plmw",2015,"ACM","Proceedings of the Programming Languages Mentoring Workshop, PLMW@POPL 2015, Mumbai, India, January 14, 2015","http://dl.acm.org/citation.cfm?id=2792434",0,1,0,0
"popl","conf/popl/2016",2016,"ACM","Proceedings of the 43rd Annual ACM SIGPLAN-SIGACT Symposium on Principles of Programming Languages, POPL 2016, St. Petersburg, FL, USA, January 20 - 22, 2016","http://dl.acm.org/citation.cfm?id=2837614",0,1,0,0
"recomb","conf/recomb/2002snp",2004,"Springer","Computational Methods for SNPs and Haplotype Inference, DIMACS/RECOMB Satellite Workshop, Piscataway, NJ, USA, November 21-22, 2002, Revised Papers",\N,0,0,0,1
"recomb","conf/recomb/2004",2004,"ACM","Proceedings of the Eighth Annual International Conference on Computational Molecular Biology, 2004, San Diego, California, USA, March 27-31, 2004",\N,0,0,0,1
"recomb","conf/recomb/2004rcg",2005,"Springer","Comparative Genomics, RECOMB 2004 International Workshop, RCG 2004, Bertinoro, Italy, October 16-19, 2004, Revised Selected Papers",\N,0,0,0,1
"recomb","conf/recomb/2004rrg",2005,"Springer","Regulatory Genomics, RECOMB 2004 International Workshop, RRG 2004, San Diego, CA, USA, March 26-27, 2004, Revised Selected Papers",\N,0,0,0,1
"recomb","conf/recomb/2005",2005,"Springer","Research in Computational Molecular Biology, 9th Annual International Conference, RECOMB 2005, Cambridge, MA, USA, May 14-18, 2005, Proceedings",\N,0,0,0,1
"recomb","conf/recomb/2005rcg",2005,"Springer","Comparative Genomics, RECOMB 2005 International Workshop, RCG 2005, Dublin, Ireland, September 18-20, 2005, Proceedings",\N,0,0,0,1
"recomb","conf/recomb/2005sbrg",2006,"Springer","Systems Biology and Regulatory Genomics, Joint Annual RECOMB 2005 Satellite Workshops on Systems Biology and on Regulatory Genomics, San Diego, CA, USA; December 2-4, 2005, Revised Selected Papers",\N,0,0,0,1
"recomb","conf/recomb/2006",2006,"Springer","Research in Computational Molecular Biology, 10th Annual International Conference, RECOMB 2006, Venice, Italy, April 2-5, 2006, Proceedings",\N,0,0,0,1
"recomb","conf/recomb/2006rcg",2006,"Springer","Comparative Genomics, RECOMB 2006 International Workshop, RCG 2006, Montreal, Canada, September 24-26, 2006, Proceedings",\N,0,0,0,1
"recomb","conf/recomb/2006sbcp",2007,"Springer","Systems Biology and Computational Proteomics, Joint RECOMB 2006 Satellite Workshops on Systems Biology and on Computational Proteomics, San Diego, CA, USA, December 1-3, 2006, Revised Selected Papers",\N,0,0,0,1
"recomb","conf/recomb/2007",2007,"Springer","Research in Computational Molecular Biology, 11th Annual International Conference, RECOMB 2007, Oakland, CA, USA, April 21-25, 2007, Proceedings",\N,0,0,0,1
"recomb","conf/recomb/2007cg",2007,"Springer","Comparative Genomics, RECOMB 2007 International Workshop, RECOMB-CG 2007, San Diego, CA, USA, September 16-18, 2007, Proceedings",\N,0,0,0,1
"recomb","conf/recomb/2008",2008,"Springer","Research in Computational Molecular Biology, 12th Annual International Conference, RECOMB 2008, Singapore, March 30 - April 2, 2008. Proceedings",\N,0,0,0,1
"recomb","conf/recomb/2008cg",2008,"Springer","Comparative Genomics, International Workshop, RECOMB-CG 2008, Paris, France, October 13-15, 2008. Proceedings",\N,0,0,0,1
"recomb","conf/recomb/2009",2009,"Springer","Research in Computational Molecular Biology, 13th Annual International Conference, RECOMB 2009, Tucson, AZ, USA, May 18-21, 2009. Proceedings","http://dx.doi.org/10.1007/978-3-642-02008-7",0,0,0,1
"recomb","conf/recomb/2009cg",2009,"Springer","Comparative Genomics, International Workshop, RECOMB-CG 2009, Budapest, Hungary, September 27-29, 2009. Proceedings","http://dx.doi.org/10.1007/978-3-642-04744-2",0,0,0,1
"recomb","conf/recomb/2010",2010,"Springer","Research in Computational Molecular Biology, 14th Annual International Conference, RECOMB 2010, Lisbon, Portugal, April 25-28, 2010. Proceedings","http://dx.doi.org/10.1007/978-3-642-12683-3",0,0,0,1
"recomb","conf/recomb/2010cg",2010,"Springer","Comparative Genomics - International Workshop, RECOMB-CG 2010, Ottawa, Canada, October 9-11, 2010. Proceedings","http://dx.doi.org/10.1007/978-3-642-16181-0",0,0,0,1
"recomb","conf/recomb/2011",2011,"Springer","Research in Computational Molecular Biology - 15th Annual International Conference, RECOMB 2011, Vancouver, BC, Canada, March 28-31, 2011. Proceedings","http://dx.doi.org/10.1007/978-3-642-20036-6",0,0,0,1
"recomb","conf/recomb/2012",2012,"Springer","Research in Computational Molecular Biology - 16th Annual International Conference, RECOMB 2012, Barcelona, Spain, April 21-24, 2012. Proceedings","http://dx.doi.org/10.1007/978-3-642-29627-7",0,0,0,1
"recomb","conf/recomb/2013",2013,"Springer","Research in Computational Molecular Biology - 17th Annual International Conference, RECOMB 2013, Beijing, China, April 7-10, 2013. Proceedings","http://dx.doi.org/10.1007/978-3-642-37195-0",0,0,0,1
"recomb","conf/recomb/2014",2014,"Springer","Research in Computational Molecular Biology - 18th Annual International Conference, RECOMB 2014, Pittsburgh, PA, USA, April 2-5, 2014, Proceedings","http://dx.doi.org/10.1007/978-3-319-05269-4",0,0,0,1
"recomb","conf/recomb/2015",2015,"Springer","Research in Computational Molecular Biology - 19th Annual International Conference, RECOMB 2015, Warsaw, Poland, April 12-15, 2015, Proceedings","http://dx.doi.org/10.1007/978-3-319-16706-0",0,0,0,1
"recomb","conf/recomb/2016",2016,"Springer","Research in Computational Molecular Biology - 20th Annual Conference, RECOMB 2016, Santa Monica, CA, USA, April 17-21, 2016, Proceedings","http://dx.doi.org/10.1007/978-3-319-31957-5",0,0,0,1
"ride","conf/ride/2000",2000,"IEEE Computer Society","Proceedings of the Tenth International Workshop on Research Issues on Data Engineering: Middleware for Mobile Business Applications and E-Commerce, San Diego, California, USA, February 27-28, 2000","http://www.computer.org/csdl/proceedings/ride/2000/0531/00/index.html",0,1,0,0
"ride","conf/ride/2001",2001,"IEEE Computer Society","Eleventh International Workshop on Research Issues in Data Engineering: Document Management for Data Intensive Business and Scientific Applications, Heidelberg, Germany, 1-2 April 2001","http://www.computer.org/csdl/proceedings/ride/2001/0957/00/index.html",0,1,0,0
"ride","conf/ride/2002",2002,"IEEE Computer Society","12th International Workshop on Research Issues in Data Engineering: Engineering E-Commerce/E-Business Systems, RIDE'02, San Jose, California, USA, February 24-25, 2002","http://www.computer.org/csdl/proceedings/ride/2002/1480/00/index.html",0,1,0,0
"ride","conf/ride/2003",2003,"IEEE Computer Society","Thirteenth International Work Shop on Research Issues in Data Engineering: Multi-lingual Information Management, RIDE-MLIM 2003, Hyderabad, India, March 10-11, 2003","http://www.computer.org/csdl/proceedings/ride/2003/2303/00/index.html",0,1,0,0
"ride","conf/ride/2004",2004,"IEEE Computer Society","14th International Workshop on Research Issues in Data Engineering (RIDE-WS-ECEG 2004), Web Services for E-Commerce and E-Government Applications, 28-29 March 2004, Boston, MA, USA","http://www.computer.org/csdl/proceedings/ride/2004/2095/00/index.html",0,1,0,0
"ride","conf/ride/2005",2005,"IEEE Computer Society","15th International Workshop on Research Issues in Data Engineering (RIDE-SDMA 2005), Stream Data Mining and Applications, 3-7 April 2005, Tokyo, Japan","http://www.computer.org/csdl/proceedings/ride/2005/2390/00/index.html",0,1,0,0
"scam","conf/scam/2001",2001,"IEEE Computer Society","1st IEEE International Workshop on Source Code Analysis and Manipulation (SCAM 2001), 10 November 2001, Florence, Italy","http://www.computer.org/csdl/proceedings/scam/2001/1387/00/index.html",0,0,1,0
"scam","conf/scam/2002",2002,"IEEE Computer Society","2nd IEEE International Workshop on Source Code Analysis and Manipulation (SCAM 2002), 1 October 2002, Montreal, Canada","http://www.computer.org/csdl/proceedings/scam/2002/1793/00/index.html",0,0,1,0
"scam","conf/scam/2003",2003,"IEEE Computer Society","3rd IEEE International Workshop on Source Code Analysis and Manipulation (SCAM 2003), 26-27 September 2003, Amsterdam, The Netherlands","http://www.computer.org/csdl/proceedings/scam/2003/2005/00/index.html",0,0,1,0
"scam","conf/scam/2004",2004,"IEEE Computer Society","4th IEEE International Workshop on Source Code Analysis and Manipulation (SCAM 2004), 15-16 September 2004, Chicago, IL, USA","http://www.computer.org/csdl/proceedings/scam/2004/2144/00/index.html",0,0,1,0
"scam","conf/scam/2005",2005,"IEEE Computer Society","5th IEEE International Workshop on Source Code Analysis and Manipulation (SCAM 2005), 30 September - 1 October 2005, Budapest, Hungary","http://www.computer.org/csdl/proceedings/scam/2005/2292/00/index.html",0,0,1,0
"scam","conf/scam/2006",2006,"IEEE Computer Society","Sixth IEEE International Workshop on Source Code Analysis and Manipulation (SCAM 2006), 27-29 September 2006, Philadelphia, Pennsylvania, USA","http://www.computer.org/csdl/proceedings/scam/2006/2353/00/index.html",0,0,1,0
"scam","conf/scam/2007",2007,"IEEE Computer Society","Seventh IEEE International Workshop on Source Code Analysis and Manipulation (SCAM 2007), September 30 - October 1, 2007, Paris, France","http://www.computer.org/csdl/proceedings/scam/2007/2880/00/index.html",0,0,1,0
"scam","conf/scam/2008",2008,"IEEE Computer Society","Eighth IEEE International Working Conference on Source Code Analysis and Manipulation (SCAM 2008), 28-29 September 2008, Beijing, China","http://www.computer.org/csdl/proceedings/scam/2008/3353/00/index.html",0,0,1,0
"scam","conf/scam/2009",2009,"IEEE Computer Society","Ninth IEEE International Working Conference on Source Code Analysis and Manipulation, SCAM 2009, Edmonton, Alberta, Canada, September 20-21, 2009","http://www.computer.org/csdl/proceedings/scam/2009/3793/00/index.html",0,0,1,0
"scam","conf/scam/2010",2010,"IEEE Computer Society","Tenth IEEE International Working Conference on Source Code Analysis and Manipulation, SCAM 2010, Timisoara, Romania, 12-13 September 2010","http://www.computer.org/csdl/proceedings/scam/2010/4178/00/index.html",0,0,1,0
"scam","conf/scam/2011",2011,"IEEE Computer Society","11th IEEE Working Conference on Source Code Analysis and Manipulation, SCAM 2011, Williamsburg, VA, USA, September 25-26, 2011","http://www.computer.org/csdl/proceedings/scam/2011/4347/00/index.html",0,0,1,0
"scam","conf/scam/2012",2012,"IEEE Computer Society","12th IEEE International Working Conference on Source Code Analysis and Manipulation, SCAM 2012, Riva del Garda, Italy, September 23-24, 2012","http://www.computer.org/csdl/proceedings/scam/2012/4783/00/index.html",0,0,1,0
"scam","conf/scam/2013",2013,"IEEE Computer Society","13th IEEE International Working Conference on Source Code Analysis and Manipulation, SCAM 2013, Eindhoven, Netherlands, September 22-23, 2013","http://www.computer.org/csdl/proceedings/scam/2013/9999/00/index.html",0,0,1,0
"scam","conf/scam/2014",2014,"IEEE Computer Society","14th IEEE International Working Conference on Source Code Analysis and Manipulation, SCAM 2014, Victoria, BC, Canada, September 28-29, 2014","http://www.computer.org/csdl/proceedings/scam/2014/6148/00/index.html",0,0,1,0
"scam","conf/scam/2015",2015,"IEEE Computer Society","15th IEEE International Working Conference on Source Code Analysis and Manipulation, SCAM 2015, Bremen, Germany, September 27-28, 2015","https://www.computer.org/csdl/proceedings/scam/2015/7529/00/index.html",0,0,1,0
"sigcomm","conf/sigcomm/2002",2002,"ACM","Proceedings of the ACM SIGCOMM 2002 Conference on Applications, Technologies, Architectures, and Protocols for Computer Communication, August 19-23, 2002, Pittsburgh, PA, USA","http://doi.acm.org/10.1145/633025",1,0,0,0
