"aaai","conf/aaai/2000",2000,"AAAI Press / The MIT Press","Proceedings of the Seventeenth National Conference on Artificial Intelligence and Twelfth Conference on on Innovative Applications of Artificial Intelligence, July 30 - August 3, 2000, Austin, Texas, USA.","http://www.aaai.org/Conferences/AAAI/aaai00.php",1,0,0,0
"aaai","conf/aaai/2002",2002,"AAAI Press / The MIT Press","Proceedings of the Eighteenth National Conference on Artificial Intelligence and Fourteenth Conference on Innovative Applications of Artificial Intelligence, July 28 - August 1, 2002, Edmonton, Alberta, Canada.","http://www.aaai.org/Conferences/AAAI/aaai02.php",1,0,0,0
"aaai","conf/aaai/2004",2004,"AAAI Press / The MIT Press","Proceedings of the Nineteenth National Conference on Artificial Intelligence, Sixteenth Conference on Innovative Applications of Artificial Intelligence, July 25-29, 2004, San Jose, California, USA",\N,1,0,0,0
"aaai","conf/aaai/2005",2005,"AAAI Press / The MIT Press","Proceedings, The Twentieth National Conference on Artificial Intelligence and the Seventeenth Innovative Applications of Artificial Intelligence Conference, July 9-13, 2005, Pittsburgh, Pennsylvania, USA",\N,1,0,0,0
"aaai","conf/aaai/2006",2006,"AAAI Press","Proceedings, The Twenty-First National Conference on Artificial Intelligence and the Eighteenth Innovative Applications of Artificial Intelligence Conference, July 16-20, 2006, Boston, Massachusetts, USA",\N,1,0,0,0
"aaai","conf/aaai/2007",2007,"AAAI Press","Proceedings of the Twenty-Second AAAI Conference on Artificial Intelligence, July 22-26, 2007, Vancouver, British Columbia, Canada",\N,1,0,0,0
"aaai","conf/aaai/2008",2008,"AAAI Press","Proceedings of the Twenty-Third AAAI Conference on Artificial Intelligence, AAAI 2008, Chicago, Illinois, USA, July 13-17, 2008",\N,1,0,0,0
"aaai","conf/aaai/2010",2010,"AAAI Press","Proceedings of the Twenty-Fourth AAAI Conference on Artificial Intelligence, AAAI 2010, Atlanta, Georgia, USA, July 11-15, 2010",\N,1,0,0,0
"aaai","conf/aaai/2010abstr",2010,"AAAI","Abstraction, Reformulation, and Approximation, Papers from the 2010 AAAI Workshop, Atlanta, Georgia, USA, July 12, 2010","http://www.aaai.org/Library/Workshops/ws10-08.php",1,0,0,0
"aaai","conf/aaai/2010coll",2010,"AAAI","Collaboratively-Built Knowledge Sources and Artificial Intelligence, Papers from the 2010 AAAI Workshop, Atlanta, Georgia, USA, July 11, 2010","http://www.aaai.org/Library/Workshops/ws10-02.php",1,0,0,0
"aaai","conf/aaai/2010game",2010,"AAAI","Interactive Decision Theory and Game Theory, Papers from the 2010 AAAI Workshop, Atlanta, Georgia, USA, July 12, 2010","http://www.aaai.org/Library/Workshops/ws10-03.php",1,0,0,0
"aaai","conf/aaai/2010meta",2010,"AAAI","Metacognition for Robust Social Systems, Papers from the 2010 AAAI Workshop, Atlanta, Georgia, USA, July 11, 2010","http://www.aaai.org/Library/Workshops/ws10-04.php",1,0,0,0
"aaai","conf/aaai/2010middle",2010,"AAAI","Enabling Intelligence through Middleware, Papers from the 2010 AAAI Robot Workshop, Atlanta, Georgia, USA, July 12, 2010","http://www.aaai.org/Library/Workshops/ws10-09.php",1,0,0,0
"aaai","conf/aaai/2010plan",2010,"AAAI","Bridging the Gap Between Task and Motion Planning, Papers from the 2010 AAAI Workshop, Atlanta, Georgia, USA, July 11, 2010","http://www.aaai.org/Library/Workshops/ws10-01.php",1,0,0,0
"aaai","conf/aaai/2010recog",2010,"AAAI","Plan, Activity, and Intent Recognition, Papers from the 2010 AAAI Workshop, Atlanta, Georgia, USA, July 12, 2010","http://www.aaai.org/Library/Workshops/ws10-05.php",1,0,0,0
"aaai","conf/aaai/2010stat",2010,"AAAI","Statistical Relational Artificial Intelligence, Papers from the 2010 AAAI Workshop, Atlanta, Georgia, USA, July 12, 2010","http://www.aaai.org/Library/Workshops/ws10-06.php",1,0,0,0
"aaai","conf/aaai/2010visual",2010,"AAAI","Visual Representations and Reasoning, Papers from the 2010 AAAI Workshop, Atlanta, Georgia, USA, July 11, 2010","http://www.aaai.org/Library/Workshops/ws10-07.php",1,0,0,0
"aaai","conf/aaai/2011",2011,"AAAI Press","Proceedings of the Twenty-Fifth AAAI Conference on Artificial Intelligence, AAAI 2011, San Francisco, California, USA, August 7-11, 2011",\N,1,0,0,0
"aaai","conf/aaai/2011aap",2011,"AAAI","Automated Action Planning for Autonomous Mobile Robots, Papers from the 2011 AAAI Workshop, San Francisco, California, USA, August 7, 2011","http://www.aaai.org/Library/Workshops/ws11-09.php",1,0,0,0
"aaai","conf/aaai/2011aarrm",2011,"AAAI","Applied Adversarial Reasoning and Risk Modeling, Papers from the 2011 AAAI Workshop, San Francisco, California, USA, August 7, 2011","http://www.aaai.org/Library/Workshops/ws11-06.php",1,0,0,0
"aaai","conf/aaai/2011acr",2011,"AAAI","Activity Context Representation: Techniques and Languages, Papers from the 2011 AAAI Workshop, San Francisco, California, USA, August 7-8, 2011","http://www.aaai.org/Library/Workshops/ws11-04.php",1,0,0,0
"aaai","conf/aaai/2011agents",2011,"AAAI","Language-Action Tools for Cognitive Artificial Agents, Papers from the 2011 AAAI Workshop, San Francisco, California, USA, August 7-8, 2011","http://www.aaai.org/Library/Workshops/ws11-14.php",1,0,0,0
"aaai","conf/aaai/2011aisl",2011,"AAAI","Artificial Intelligence and Smarter Living: The Conquest of Complexity, Papers from the 2011 AAAI Workshop, San Francisco, California, USA, August 8, 2011","http://www.aaai.org/Library/Workshops/ws11-07.php",1,0,0,0
"aaai","conf/aaai/2011am",2011,"AAAI","Analyzing Microtext, Papers from the 2011 AAAI Workshop, San Francisco, California, USA, August 8, 2011","http://www.aaai.org/Library/Workshops/ws11-05.php",1,0,0,0
"aaai","conf/aaai/2011care",2011,"AAAI","Human-Robot Interaction in Elder Care, Papers from the 2011 AAAI Workshop, San Francisco, California, USA, August 8, 2011","http://www.aaai.org/Library/Workshops/ws11-12.php",1,0,0,0
"aaai","conf/aaai/2011cloud",2011,"AAAI","AI for Data Center Management and Cloud Computing, Papers from the 2011 AAAI Workshop, San Francisco, California, USA, August 7, 2011","http://www.aaai.org/Library/Workshops/ws11-08.php",1,0,0,0
"aaai","conf/aaai/2011cmna",2011,"AAAI","Computational Models of Natural Argument, Papers from the 2011 AAAI Workshop, San Francisco, California, USA, August 7, 2011","http://www.aaai.org/Library/Workshops/ws11-10.php",1,0,0,0
"aaai","conf/aaai/2011game",2011,"AAAI","Interactive Decision Theory and Game Theory, Papers from the 2011 AAAI Workshop, San Francisco, California, USA, August 8, 2011","http://www.aaai.org/Library/Workshops/ws11-13.php",1,0,0,0
"aaai","conf/aaai/2011hc",2011,"AAAI","Human Computation, Papers from the 2011 AAAI Workshop, San Francisco, California, USA, August 8, 2011","http://www.aaai.org/Library/Workshops/ws11-11.php",1,0,0,0
"aaai","conf/aaai/2011learning",2011,"AAAI","Lifelong Learning, Papers from the 2011 AAAI Workshop, San Francisco, California, USA, August 7, 2011","http://www.aaai.org/Library/Workshops/ws11-15.php",1,0,0,0
"aaai","conf/aaai/2011plan",2011,"AAAI","Plan, Activity, and Intent Recognition, Papers from the 2011 AAAI Workshop, San Francisco, California, USA, August 07, 2011","http://www.aaai.org/Library/Workshops/ws11-16.php",1,0,0,0
"aaai","conf/aaai/2011visual",2011,"AAAI","Scalable Integration of Analytics and Visualization, Papers from the 2011 AAAI Workshop, San Francisco, California, USA, August 07, 2011","http://www.aaai.org/Library/Workshops/ws11-17.php",1,0,0,0
"aaai","conf/aaai/2012",2012,"AAAI Press","Proceedings of the Twenty-Sixth AAAI Conference on Artificial Intelligence, July 22-26, 2012, Toronto, Ontario, Canada.",\N,1,0,0,0
"aaai","conf/aaai/2013",2013,"AAAI Press","Proceedings of the Twenty-Seventh AAAI Conference on Artificial Intelligence, July 14-18, 2013, Bellevue, Washington, USA.","http://www.aaai.org/Library/AAAI/aaai13contents.php",1,0,0,0
"aaai","conf/aaai/2013late",2013,"AAAI","Late-Breaking Developments in the Field of Artificial Intelligence, Bellevue, Washington, USA, July 14-18, 2013","http://www.aaai.org/Library/Workshops/ws13-17.php",1,0,0,0
"aaai","conf/aaai/2013learning",2013,"AAAI","Learning Rich Representations from Low-Level Sensors, Papers from the 2013 AAAI Workshop, Bellevue, Washington, USA, July 15, 2013","http://www.aaai.org/Library/Workshops/ws13-12.php",1,0,0,0
"aaai","conf/aaai/2013plan",2013,"AAAI","Plan, Activity, and Intent Recognition, Papers from the 2013 AAAI Workshop, Bellevue, Washington, USA, July 15, 2013","http://www.aaai.org/Library/Workshops/ws13-13.php",1,0,0,0
"aaai","conf/aaai/2013space",2013,"AAAI","Space, Time, and Ambient Intelligence, Papers from the 2013 AAAI Workshop, Bellevue, Washington, USA, July 14, 2013","http://www.aaai.org/Library/Workshops/ws13-14.php",1,0,0,0
"aaai","conf/aaai/2013stat",2013,"AAAI","Statistical Relational Artificial Intelligence, Papers from the 2013 AAAI Workshop, Bellevue, Washington, USA, July 15, 2013","http://www.aaai.org/Library/Workshops/ws13-16.php",1,0,0,0
"aaai","conf/aaai/2013trading",2013,"AAAI","Trading Agent Design and Analysis, Papers from the 2013 AAAI Workshop, Bellevue, Washington, USA, July 15, 2013","http://www.aaai.org/Library/Workshops/ws13-15.php",1,0,0,0
"aaai","conf/aaai/2014",2014,"AAAI Press","Proceedings of the Twenty-Eighth AAAI Conference on Artificial Intelligence, July 27 -31, 2014, Québec City, Québec, Canada.","http://www.aaai.org/Library/AAAI/aaai14contents.php",1,0,0,0
"aaai","conf/aaai/2014maiha",2014,"AAAI","Modern Artificial Intelligence for Health Analytics, Papers from the 2014 AAAI Workshop, Québec City, Québec, Canada, July 27, 2014","http://www.aaai.org/Library/Workshops/ws14-08.php",1,0,0,0
"aaai","conf/aaai/2014mpref",2014,"AAAI Press","Multidisciplinary Workshop on Advances in Preference Handling, Papers from the 2014 AAAI Workshop, MPREF@AAAI, July 28, 2014, Quebec City, Canada","http://www.aaai.org/Library/Workshops/ws14-10.php",1,0,0,0
"aaai","conf/aaai/2014stat",2014,"AAAI","Statistical Relational Artificial Intelligence, Papers from the 2014 AAAI Workshop, Québec City, Québec, Canada, July 27, 2014","http://www.aaai.org/Library/Workshops/ws14-13.php",1,0,0,0
"aaai","conf/aaai/2015",2015,"AAAI Press","Proceedings of the Twenty-Ninth AAAI Conference on Artificial Intelligence, January 25-30, 2015, Austin, Texas, USA.","http://www.aaai.org/Library/AAAI/aaai15contents.php",1,0,0,0
"aaai","conf/aaai/2015aconfig",2015,"AAAI Press","Algorithm Configuration, Papers from the 2015 AAAI Workshop, Austin, Texas, USA, January 26, 2015.","http://www.aaai.org/Library/Workshops/ws15-01.php",1,0,0,0
"aaai","conf/aaai/2015assistive",2015,"AAAI Press","Artificial Intelligence Applied to Assistive Technologies and Smart Environments, Papers from the 2015 AAAI Workshop, Austin, Texas, USA, January 25, 2015.","http://www.aaai.org/Library/Workshops/ws15-03.php",1,0,0,0
"aaai","conf/aaai/2015cities",2015,"AAAI Press","Artificial Intelligence for Cities, Papers from the 2015 AAAI Workshop, Austin, Texas, USA, January 25, 2015.","http://www.aaai.org/Library/Workshops/ws15-04.php",1,0,0,0
"aaai","conf/aaai/2015ethics",2015,"AAAI Press","Artificial Intelligence and Ethics, Papers from the 2015 AAAI Workshop, Austin, Texas, USA, January 25, 2015.","http://www.aaai.org/Library/Workshops/ws15-02.php",1,0,0,0
"aaai","conf/aaai/2015games",2015,"AAAI Press","Learning for General Competency in Video Games, Papers from the 2015 AAAI Workshop, Austin, Texas, USA, January 26, 2015.","http://www.aaai.org/Library/Workshops/ws15-10.php",1,0,0,0
"aaai","conf/aaai/2015poker",2015,"AAAI Press","Computer Poker and Imperfect Information, Papers from the 2015 AAAI Workshop, Austin, Texas, USA, January 26, 2015.","http://www.aaai.org/Library/Workshops/ws15-07.php",1,0,0,0
"aaai","conf/aaai/2015robot",2015,"AAAI Press","Knowledge, Skill, and Behavior Transfer in Autonomous Robots, Papers from the 2015 AAAI Workshop, Austin, Texas, USA, January 25, 2015.","http://www.aaai.org/Library/Workshops/ws15-09.php",1,0,0,0
"aaai","conf/aaai/2015sbd",2015,"AAAI Press","Scholarly Big Data: AI Perspectives, Challenges, and Ideas, Papers from the 2015 AAAI Workshop, Austin, Texas, USA, January, 2015.","http://www.aaai.org/Library/Workshops/ws15-13.php",1,0,0,0
"aaai","conf/aaai/2015sustainability",2015,"AAAI Press","Computational Sustainability, Papers from the 2015 AAAI Workshop, Austin, Texas, USA, January 26, 2015.","http://www.aaai.org/Library/Workshops/ws15-06.php",1,0,0,0
"aaai","conf/aaai/2015transportation",2015,"AAAI Press","Artificial Intelligence for Transportation: Advice, Interactivity, and Actor Modeling, Papers from the 2015 AAAI Workshop, Austin, Texas, USA, January 26, 2015.","http://www.aaai.org/Library/Workshops/ws15-05.php",1,0,0,0
"aaai","conf/aaai/2015trust",2015,"AAAI Press","Incentive and Trust in E-Communities, Papers from the 2015 AAAI Workshop, Austin, Texas, USA, January 25, 2015.","http://www.aaai.org/Library/Workshops/ws15-08.php",1,0,0,0
"aaai","conf/aaai/2015w3phi",2015,"AAAI Press","World Wide Web and Public Health Intelligence, Papers from the 2015 AAAI Workshop, Austin, Texas, USA, January, 2015.","http://www.aaai.org/Library/Workshops/ws15-15.php",1,0,0,0
"aaai","conf/aaai/2016",2016,"AAAI Press","Proceedings of the Thirtieth AAAI Conference on Artificial Intelligence, February 12-17, 2016, Phoenix, Arizona, USA.","http://www.aaai.org/Library/AAAI/aaai16contents.php",1,0,0,0
"aaai","conf/aaai/2016assistive",2016,"AAAI Press","Artificial Intelligence Applied to Assistive Technologies and Smart Environments, Papers from the 2016 AAAI Workshop, Phoenix, Arizona, USA, February 12, 2016 ","http://www.aaai.org/Library/Workshops/ws16-01.php",1,0,0,0
"aaai","conf/aaai/2016cognitive",2016,"AAAI Press","Symbiotic Cognitive Systems, Papers from the 2016 AAAI Workshop, Phoenix, Arizona, USA, February 13, 2016.","http://www.aaai.org/Library/Workshops/ws16-14.php",1,0,0,0
"aaai","conf/aaai/2016data",2016,"AAAI Press","Scholarly Big Data: AI Perspectives, Challenges, and Ideas, Papers from the 2016 AAAI Workshop, Phoenix, Arizona, USA, February 13, 2016.","http://www.aaai.org/Library/Workshops/ws16-13.php",1,0,0,0
"aaai","conf/aaai/2016ethics",2016,"AAAI Press","AI, Ethics, and Society, Papers from the 2016 AAAI Workshop, Phoenix, Arizona, USA, February 13, 2016.","http://www.aaai.org/Library/Workshops/ws16-02.php",1,0,0,0
"aaai","conf/aaai/2016grid",2016,"AAAI Press","AI for Smart Grids and Smart Buildings, Papers from the 2016 AAAI Workshop, Phoenix, Arizona, USA, February 12, 2016.","http://www.aaai.org/Library/Workshops/ws16-04.php",1,0,0,0
"aaai","conf/aaai/2016health",2016,"AAAI Press","Expanding the Boundaries of Health Informatics Using AI, Papers from the 2016 AAAI Workshop, Phoenix, Arizona, USA, February 13, 2016.","http://www.aaai.org/Library/Workshops/ws16-08.php",1,0,0,0
"aaai","conf/aaai/2016hybrid",2016,"AAAI Press","Planning for Hybrid Systems, Papers from the 2016 AAAI Workshop, Phoenix, Arizona, USA, February 13, 2016.","http://www.aaai.org/Library/Workshops/ws16-12.php",1,0,0,0
"aaai","conf/aaai/2016learning",2016,"AAAI Press","Declarative Learning Based Programming, Papers from the 2016 AAAI Workshop, Phoenix, Arizona, USA, February 13, 2016.","http://www.aaai.org/Library/Workshops/ws16-07.php",1,0,0,0
"aaai","conf/aaai/2016ma",2016,"AAAI Press","Multiagent Interaction without Prior Coordination, Papers from the 2016 AAAI Workshop, Phoenix, Arizona, USA, February 13, 2016.","http://www.aaai.org/Library/Workshops/ws16-11.php",1,0,0,0
"aaai","conf/aaai/2016np",2016,"AAAI Press","Beyond NP, Papers from the 2016 AAAI Workshop, Phoenix, Arizona, USA, February 12, 2016.","http://www.aaai.org/Library/Workshops/ws16-05.php",1,0,0,0
"aaai","conf/aaai/2016poker",2016,"AAAI Press","Computer Poker and Imperfect Information Games, Papers from the 2016 AAAI Workshop, Phoenix, Arizona, USA, February 13, 2016.","http://www.aaai.org/Library/Workshops/ws16-06.php",1,0,0,0
"aaai","conf/aaai/2016security",2016,"AAAI Press","Artificial Intelligence for Cyber Security, Papers from the 2016 AAAI Workshop, Phoenix, Arizona, USA, February 12, 2016.","http://www.aaai.org/Library/Workshops/ws16-03.php",1,0,0,0
"aaai","conf/aaai/2016text",2016,"AAAI Press","Knowledge Extraction from Text, Papers from the 2016 AAAI Workshop, Phoenix, Arizona, USA, February 12, 2016.","http://www.aaai.org/Library/Workshops/ws16-10.php",1,0,0,0
"aaai","conf/aaai/2016trust",2016,"AAAI Press","Incentives and Trust in Electronic Communities, Papers from the 2016 AAAI Workshop, Phoenix, Arizona, USA, February 12, 2016.","http://www.aaai.org/Library/Workshops/ws16-09.php",1,0,0,0
"aaai","conf/aaai/2016wwwhi",2016,"AAAI Press","World Wide Web and Population Health Intelligence, Papers from the 2016 AAAI Workshop, Phoenix, Arizona, USA, February 12, 2016.","http://www.aaai.org/Library/Workshops/ws16-15.php",1,0,0,0
"aaai","conf/aaai/BowmanTB00",2000,\N,"A Methodology for Modeling and Representing Expert Knowledge that Supports Teaching-Based Intelligent Agent Development.","http://www.aaai.org/Library/AAAI/2000/aaai00-148.php",1,0,0,0
"aaai","conf/aaai/Johnson00",2000,\N,"Belief Revision in a Deductively Open Belief Space.","http://www.aaai.org/Library/AAAI/2000/aaai00-187.php",1,0,0,0
"acl","conf/acl/2000",2000,"ACL","38th Annual Meeting of the Association for Computational Linguistics, Hong Kong, China, October 1-8, 2000.","http://aclweb.org/anthology-new/P/P00/",1,0,0,0
"acl","conf/acl/2001",2001,"Morgan Kaufmann Publishers","Association for Computational Linguistic, 39th Annual Meeting and 10th Conference of the European Chapter, Proceedings of the Conference, July 9-11, 2001, Toulouse, France.","http://aclweb.org/anthology-new/P/P01/",1,0,0,0
"acl","conf/acl/2001c",2001,"CNRS, Toulose, France","Association for Computational Linguistic, 39th Annual Meeting and 10th Conference of the European Chapter, Companion Volume to the Proceedings of the Conference: Proceedings of the Student Research Workshop and Tutorial Abstracts, July 9-11, 2001, Toulouse, France.",\N,1,0,0,0
"acl","conf/acl/2002",2002,"ACL","Proceedings of the 40th Annual Meeting of the Association for Computational Linguistics, July 6-12, 2002, Philadelphia, PA, USA.","http://aclweb.org/anthology-new/P/P02/",1,0,0,0
"acl","conf/acl/2002bio",2002,"ACL","Proceedings of the ACL 2002 Workshop on Natural Language Processing in the Biomedical Domain, July 11, 2002, University of Pennsylvania, Philadelphia, PA, USA.","http://aclweb.org/anthology-new/W/W02/#0300",1,0,0,0
"acl","conf/acl/2003",2003,"ACL","Proceedings of the 41st Annual Meeting of the Association for Computational Linguistics, 7-12 July 2003, Sapporo Convention Center, Sapporo, Japan.","http://aclweb.org/anthology-new/P/P03/#1000",1,0,0,0
"acl","conf/acl/2003c",2003,"The Association for Computer Linguistics","ACL 2003, 41st Annual Meeting of the Association for Computational Linguistics, Companion Volume to the Proceedings, 7-12 July 2003, Sapporo Convention Center, Sapporo, Japan","http://aclweb.org/anthology-new/P/P03/#2000",1,0,0,0
"acl","conf/acl/2004",2004,"ACL","Proceedings of the 42nd Annual Meeting of the Association for Computational Linguistics, 21-26 July, 2004, Barcelona, Spain.","http://aclweb.org/anthology-new/P/P04/",1,0,0,0
"acl","conf/acl/2005",2005,"The Association for Computer Linguistics","ACL 2005, 43rd Annual Meeting of the Association for Computational Linguistics, Proceedings of the Conference, 25-30 June 2005, University of Michigan, USA","http://aclweb.org/anthology-new/P/P05/",1,0,0,0
"acl","conf/acl/2006",2006,"The Association for Computer Linguistics","ACL 2006, 21st International Conference on Computational Linguistics and 44th Annual Meeting of the Association for Computational Linguistics, Proceedings of the Conference, Sydney, Australia, 17-21 July 2006","http://aclweb.org/anthology/P/P06/",1,0,0,0
"acl","conf/acl/2007",2007,"The Association for Computational Linguistics","ACL 2007, Proceedings of the 45th Annual Meeting of the Association for Computational Linguistics, June 23-30, 2007, Prague, Czech Republic",\N,1,0,0,0
"acl","conf/acl/2008",2008,"The Association for Computer Linguistics","ACL 2008, Proceedings of the 46th Annual Meeting of the Association for Computational Linguistics, June 15-20, 2008, Columbus, Ohio, USA","http://aclweb.org/anthology/P/P08/",1,0,0,0
"acl","conf/acl/2008d",2008,"The Association for Computer Linguistics","ACL 2008, Proceedings of the 46th Annual Meeting of the Association for Computational Linguistics, June 15-20, 2008, Columbus, Ohio, USA, Demo Papers",\N,1,0,0,0
"acl","conf/acl/2008r",2008,"The Association for Computer Linguistics","ACL 2008, Proceedings of the 46th Annual Meeting of the Association for Computational Linguistics, June 15-20, 2008, Columbus, Ohio, USA, Student Research Workshop",\N,1,0,0,0
"acl","conf/acl/2008s",2008,"The Association for Computer Linguistics","ACL 2008, Proceedings of the 46th Annual Meeting of the Association for Computational Linguistics, June 15-20, 2008, Columbus, Ohio, USA, Short Papers",\N,1,0,0,0
"acl","conf/acl/2008t",2008,"The Association for Computer Linguistics","ACL 2008, Proceedings of the 46th Annual Meeting of the Association for Computational Linguistics, June 15-20, 2008, Columbus, Ohio, USA, Tutorial Abstracts",\N,1,0,0,0
"acl","conf/acl/2009",2009,"The Association for Computer Linguistics","ACL 2009, Proceedings of the 47th Annual Meeting of the Association for Computational Linguistics and the 4th International Joint Conference on Natural Language Processing of the AFNLP, 2-7 August 2009, Singapore",\N,1,0,0,0
"acl","conf/acl/2009d",2009,"The Association for Computer Linguistics","ACL 2009, Proceedings of the 47th Annual Meeting of the Association for Computational Linguistics and the 4th International Joint Conference on Natural Language Processing of the AFNLP, 2-7 August 2009, Singapore, Software Demonstrations",\N,1,0,0,0
"acl","conf/acl/2009r",2009,"The Association for Computer Linguistics","ACL 2009, Proceedings of the 47th Annual Meeting of the Association for Computational Linguistics and the 4th International Joint Conference on Natural Language Processing of the AFNLP, 2-7 August 2009, Singapore, Student Research Workshop",\N,1,0,0,0
"acl","conf/acl/2009s",2009,"The Association for Computer Linguistics","ACL 2009, Proceedings of the 47th Annual Meeting of the Association for Computational Linguistics and the 4th International Joint Conference on Natural Language Processing of the AFNLP, 2-7 August 2009, Singapore, Short Papers",\N,1,0,0,0
"acl","conf/acl/2010",2010,"The Association for Computer Linguistics","ACL 2010, Proceedings of the 48th Annual Meeting of the Association for Computational Linguistics, July 11-16, 2010, Uppsala, Sweden",\N,1,0,0,0
"acl","conf/acl/2010d",2010,"The Association for Computer Linguistics","ACL 2010, Proceedings of the 48th Annual Meeting of the Association for Computational Linguistics, July 11-16, 2010, Uppsala, Sweden, System Demonstrations",\N,1,0,0,0
"acl","conf/acl/2010r",2010,"The Association for Computer Linguistics","ACL 2010, Proceedings of the 48th Annual Meeting of the Association for Computational Linguistics, July 11-16, 2010, Uppsala, Sweden, Student Research Workshop",\N,1,0,0,0
"acl","conf/acl/2010s",2010,"The Association for Computer Linguistics","ACL 2010, Proceedings of the 48th Annual Meeting of the Association for Computational Linguistics, July 11-16, 2010, Uppsala, Sweden, Short Papers",\N,1,0,0,0
"acl","conf/acl/2011",2011,"The Association for Computer Linguistics","The 49th Annual Meeting of the Association for Computational Linguistics: Human Language Technologies, Proceedings of the Conference, 19-24 June, 2011, Portland, Oregon, USA",\N,1,0,0,0
"acl","conf/acl/2011d",2011,"The Association for Computer Linguistics","The 49th Annual Meeting of the Association for Computational Linguistics: Human Language Technologies, Proceedings of the Conference, 19-24 June, 2011, Portland, Oregon, USA - System Demonstrations",\N,1,0,0,0
"acl","conf/acl/2011r",2011,"The Association for Computer Linguistics","The 49th Annual Meeting of the Association for Computational Linguistics: Human Language Technologies, Proceedings of the Conference, 19-24 June, 2011, Portland, Oregon, USA - Student Session",\N,1,0,0,0
"acl","conf/acl/2011s",2011,"The Association for Computer Linguistics","The 49th Annual Meeting of the Association for Computational Linguistics: Human Language Technologies, Proceedings of the Conference, 19-24 June, 2011, Portland, Oregon, USA - Short Papers",\N,1,0,0,0
"acl","conf/acl/2011t",2011,"The Association for Computer Linguistics","The 49th Annual Meeting of the Association for Computational Linguistics: Human Language Technologies, Proceedings of the Conference, 19-24 June, 2011, Portland, Oregon, USA - Tutorial Abstracts",\N,1,0,0,0
"acl","conf/acl/2012-1",2012,"The Association for Computer Linguistics","The 50th Annual Meeting of the Association for Computational Linguistics, Proceedings of the Conference, July 8-14, 2012, Jeju Island, Korea - Volume 1: Long Papers",\N,1,0,0,0
"acl","conf/acl/2012-2",2012,"The Association for Computer Linguistics","The 50th Annual Meeting of the Association for Computational Linguistics, Proceedings of the Conference, July 8-14, 2012, Jeju Island, Korea - Volume 2: Short Papers",\N,1,0,0,0
"acl","conf/acl/2012d",2012,"The Association for Computer Linguistics","The 50th Annual Meeting of the Association for Computational Linguistics, Proceedings of the System Demonstrations, July 10, 2012, Jeju Island, Korea",\N,1,0,0,0
"acl","conf/acl/2012t",2012,"The Association for Computer Linguistics","The 50th Annual Meeting of the Association for Computational Linguistics, Tutorial Abstracts, July 8, 2012, Jeju Island, Korea",\N,1,0,0,0
